0,1
/home/rpalomares/TFM/TFM-Docs-01-40-ALTO/lines/IMG_5867_output_19.png,San Quintin doze de octubre de mil Sete-
/home/rpalomares/TFM/TFM-Docs-01-40-ALTO/lines/IMG_5892_output_42.png,"Y asi copiada dha Letra, el referido Dn. Fernando Roger"
/home/rpalomares/TFM/TFM-Docs-01-40-ALTO/lines/IMG_5890_output_24.png,que asentaran vmds a cuenta como por aviso de
/home/rpalomares/TFM/TFM-Docs-01-40-ALTO/lines/IMG_5892_output_29.png,"noventa, y tres p. Libras noventa y una, diez y nueve chelines"
/home/rpalomares/TFM/TFM-Docs-01-40-ALTO/lines/IMG_5888_output_06.png,Protesto de Letra
/home/rpalomares/TFM/TFM-Docs-01-40-ALTO/lines/IMG_5863_output_01.png,Veinte maravedis.
/home/rpalomares/TFM/TFM-Docs-01-40-ALTO/lines/IMG_5897_output_13.png,e Yo lo doy de lo que dicho es en la forma qe puedo
/home/rpalomares/TFM/TFM-Docs-01-40-ALTO/lines/IMG_5884_output_01.png,Protesto de Letra
/home/rpalomares/TFM/TFM-Docs-01-40-ALTO/lines/IMG_5869_output_01.png,Veinte maravedis.
/home/rpalomares/TFM/TFM-Docs-01-40-ALTO/lines/IMG_5886_output_09.png,Los Sres. Lecuteun Despontes
/home/rpalomares/TFM/TFM-Docs-01-40-ALTO/lines/IMG_5872_output_02.png,Veinte maravedis.
/home/rpalomares/TFM/TFM-Docs-01-40-ALTO/lines/IMG_5871_output_11.png,"engaño tenmino de los dos años, y las demas de"
/home/rpalomares/TFM/TFM-Docs-01-40-ALTO/lines/IMG_5892_output_01.png,Veinte maravedis.
/home/rpalomares/TFM/TFM-Docs-01-40-ALTO/lines/IMG_5882_output_33.png,viendolo solicitado en ellas seme informo por Dn.
/home/rpalomares/TFM/TFM-Docs-01-40-ALTO/lines/IMG_5873_output_16.png,dos y q. se causaron hasta su Real y efectivo pago se
/home/rpalomares/TFM/TFM-Docs-01-40-ALTO/lines/IMG_5864_output_28.png,bre que sino haria los protestos enesta ra-
/home/rpalomares/TFM/TFM-Docs-01-40-ALTO/lines/IMG_5880_output_06.png,En la ciudad de Cadiz a catorce dias
/home/rpalomares/TFM/TFM-Docs-01-40-ALTO/lines/IMG_5876_output_03.png,"MARAVEDIS, AÑO MIL"
/home/rpalomares/TFM/TFM-Docs-01-40-ALTO/lines/IMG_5865_output_19.png,de los dños. de protesto y este immum. y de todo ello por
/home/rpalomares/TFM/TFM-Docs-01-40-ALTO/lines/IMG_5896_output_31.png,"a fin que la acepten lisa y llanamente, y de lo"
/home/rpalomares/TFM/TFM-Docs-01-40-ALTO/lines/IMG_5866_output_06.png,favor el mas bastante recivo y Cecion de
/home/rpalomares/TFM/TFM-Docs-01-40-ALTO/lines/IMG_5884_output_39.png,"del librador endosantes, y de quien mas haya lugar; En cuya"
/home/rpalomares/TFM/TFM-Docs-01-40-ALTO/lines/IMG_5863_output_33.png,Acepton.
/home/rpalomares/TFM/TFM-Docs-01-40-ALTO/lines/IMG_5872_output_34.png,atento y seguro servidor B. L. M. de vm. Vale por Do-
/home/rpalomares/TFM/TFM-Docs-01-40-ALTO/lines/IMG_5876_output_33.png,orden de Dn. Edmund Baehm. y Compañia quatro mil pesos dea ocho reales
/home/rpalomares/TFM/TFM-Docs-01-40-ALTO/lines/IMG_5892_output_16.png,"dha Ciudad, al qe. doi fee. conosco, y"
/home/rpalomares/TFM/TFM-Docs-01-40-ALTO/lines/IMG_5863_output_17.png,Dn. Guillermo Gordon vezino y
/home/rpalomares/TFM/TFM-Docs-01-40-ALTO/lines/IMG_5861_output_16.png,esta vezindad y Comercio a quien doy
/home/rpalomares/TFM/TFM-Docs-01-40-ALTO/lines/IMG_5870_output_21.png,de Burum
/home/rpalomares/TFM/TFM-Docs-01-40-ALTO/lines/IMG_5893_output_03.png,"recanvios, q. se causaren seran pr. su cuenta la del"
/home/rpalomares/TFM/TFM-Docs-01-40-ALTO/lines/IMG_5873_output_03.png,compañia valor en contado Eduardo Bon-
/home/rpalomares/TFM/TFM-Docs-01-40-ALTO/lines/IMG_5873_output_23.png,tas melo pidio por testimonio e yo lo doy delo
/home/rpalomares/TFM/TFM-Docs-01-40-ALTO/lines/IMG_5868_output_30.png,Paris diez y siete de Noviembre de mil
/home/rpalomares/TFM/TFM-Docs-01-40-ALTO/lines/IMG_5878_output_43.png,"fecto le proteste que todos los daños, perjuicios, cambios recam-"
/home/rpalomares/TFM/TFM-Docs-01-40-ALTO/lines/IMG_5865_output_31.png,"dos los gastos, canvios necesarios por juicios, y daños"
/home/rpalomares/TFM/TFM-Docs-01-40-ALTO/lines/IMG_5894_output_43.png,eyo el Essno. lo hize preste. y requeri con la vista
/home/rpalomares/TFM/TFM-Docs-01-40-ALTO/lines/IMG_5868_output_17.png,rent Chartelain y Compañia: A Don
/home/rpalomares/TFM/TFM-Docs-01-40-ALTO/lines/IMG_5885_output_03.png,"MARAVEDIS, AÑO DE MIL"
/home/rpalomares/TFM/TFM-Docs-01-40-ALTO/lines/IMG_5871_output_25.png,dazn. Sin quedan como no queda obligado arsaneamto.
/home/rpalomares/TFM/TFM-Docs-01-40-ALTO/lines/IMG_5869_output_09.png,doze Rs plata vieja valor en nosotros mis-
/home/rpalomares/TFM/TFM-Docs-01-40-ALTO/lines/IMG_5894_output_14.png,"pietario del Numero, y mayor"
/home/rpalomares/TFM/TFM-Docs-01-40-ALTO/lines/IMG_5878_output_31.png,Aceptacn
/home/rpalomares/TFM/TFM-Docs-01-40-ALTO/lines/IMG_5878_output_12.png,En la ciudad de Cadiz aprimer dia del
/home/rpalomares/TFM/TFM-Docs-01-40-ALTO/lines/IMG_5896_output_33.png,"cambios, recambios, y perjuicios causados y que se"
/home/rpalomares/TFM/TFM-Docs-01-40-ALTO/lines/IMG_5864_output_17.png,Y asi copiada otra Letra y endoso el referi-
/home/rpalomares/TFM/TFM-Docs-01-40-ALTO/lines/IMG_5869_output_05.png,TRES.
/home/rpalomares/TFM/TFM-Docs-01-40-ALTO/lines/IMG_5873_output_30.png,de Burum
/home/rpalomares/TFM/TFM-Docs-01-40-ALTO/lines/IMG_5876_output_37.png,Paguese a la orden dedn. Juan Monphy valor en cuenta de retro Edmund Baechm y Compa.
/home/rpalomares/TFM/TFM-Docs-01-40-ALTO/lines/IMG_5863_output_02.png,"SELLO QVARTO, VEINTE"
/home/rpalomares/TFM/TFM-Docs-01-40-ALTO/lines/IMG_5889_output_29.png,de Burum
/home/rpalomares/TFM/TFM-Docs-01-40-ALTO/lines/IMG_5862_output_05.png,"cambios que se causaren serian p. su cuenta, ladelos"
/home/rpalomares/TFM/TFM-Docs-01-40-ALTO/lines/IMG_5876_output_22.png,pesos dos mil dea ocho reales plata auno y medio vio pague Vmd.
/home/rpalomares/TFM/TFM-Docs-01-40-ALTO/lines/IMG_5861_output_26.png,nosotros mismos dos mil y doscientos ducados deplata dea tres-
/home/rpalomares/TFM/TFM-Docs-01-40-ALTO/lines/IMG_5889_output_03.png,nant Bridel y compañia contra quienes viene libra-
/home/rpalomares/TFM/TFM-Docs-01-40-ALTO/lines/IMG_5890_output_38.png,Padre Hijo y Compañia y les requiera la pagen luego y
/home/rpalomares/TFM/TFM-Docs-01-40-ALTO/lines/IMG_5880_output_31.png,me pidio la presente original a los Señores Dn Andres Ferrani
/home/rpalomares/TFM/TFM-Docs-01-40-ALTO/lines/IMG_5889_output_04.png,das y les requiera la acepten y de no hazerlo le protes-
/home/rpalomares/TFM/TFM-Docs-01-40-ALTO/lines/IMG_5871_output_24.png,correspda. con las fuerzs. y firmezas necesas. pa. su vali-
/home/rpalomares/TFM/TFM-Docs-01-40-ALTO/lines/IMG_5869_output_19.png,octubre de mil setecientos noventa y dos. Duple-
/home/rpalomares/TFM/TFM-Docs-01-40-ALTO/lines/IMG_5892_output_07.png,Dn. Fernando Roger
/home/rpalomares/TFM/TFM-Docs-01-40-ALTO/lines/IMG_5894_output_40.png,cambios y recambios que se causaren seran por
/home/rpalomares/TFM/TFM-Docs-01-40-ALTO/lines/IMG_5861_output_18.png,Apoderado cual me exhibio una Letra primera de
/home/rpalomares/TFM/TFM-Docs-01-40-ALTO/lines/IMG_5896_output_20.png,"vedis, de treinta y dos reales de Plata. A noventa dias"
/home/rpalomares/TFM/TFM-Docs-01-40-ALTO/lines/IMG_5874_output_23.png,"ma que mas combenga, y haciendo pa-"
/home/rpalomares/TFM/TFM-Docs-01-40-ALTO/lines/IMG_5891_output_21.png,de Burum
/home/rpalomares/TFM/TFM-Docs-01-40-ALTO/lines/IMG_5866_output_13.png,Josef Rodriguez
/home/rpalomares/TFM/TFM-Docs-01-40-ALTO/lines/IMG_5870_output_14.png,basen lo que deja hecho y contra la referida
/home/rpalomares/TFM/TFM-Docs-01-40-ALTO/lines/IMG_5889_output_01.png,Y asi copiada dicha letra y endosos el referido Dn. Diego
/home/rpalomares/TFM/TFM-Docs-01-40-ALTO/lines/IMG_5880_output_04.png,Los Sres. Dn Andres Ferrani
/home/rpalomares/TFM/TFM-Docs-01-40-ALTO/lines/IMG_5899_output_05.png,tienen firmada y cumplir este dia el plazo asigna-
/home/rpalomares/TFM/TFM-Docs-01-40-ALTO/lines/IMG_5892_output_10.png,En la ciudad de Cadiz a quinze dias del
/home/rpalomares/TFM/TFM-Docs-01-40-ALTO/lines/IMG_5881_output_23.png,ligencias y solicitudes qe. precisas sean sobre qe. otorga en su favor el
/home/rpalomares/TFM/TFM-Docs-01-40-ALTO/lines/IMG_5869_output_26.png,Prosigue
/home/rpalomares/TFM/TFM-Docs-01-40-ALTO/lines/IMG_5881_output_20.png,q le corresponden pa. percibir y cobrar de quien pertenesca la cantidad de la mencio-
/home/rpalomares/TFM/TFM-Docs-01-40-ALTO/lines/IMG_5898_output_04.png,SETECIENTOS NOVENTA Y
/home/rpalomares/TFM/TFM-Docs-01-40-ALTO/lines/IMG_5898_output_31.png,"tos noventa, y tres.= Lannes Hermanos"
/home/rpalomares/TFM/TFM-Docs-01-40-ALTO/lines/IMG_5896_output_25.png,el aviso de: Digo Vt Supra = Luis Feline = A los Señores
/home/rpalomares/TFM/TFM-Docs-01-40-ALTO/lines/IMG_5882_output_11.png,no y del comercio de la misma a quien
/home/rpalomares/TFM/TFM-Docs-01-40-ALTO/lines/IMG_5876_output_07.png,Dn. Juan Monphy.
/home/rpalomares/TFM/TFM-Docs-01-40-ALTO/lines/IMG_5886_output_25.png,"ento sesenta y tres ducados, once sueldos y ocho dineros de a trescientos"
/home/rpalomares/TFM/TFM-Docs-01-40-ALTO/lines/IMG_5863_output_20.png,"mo su Apoderado gral, y me exivio una letra"
/home/rpalomares/TFM/TFM-Docs-01-40-ALTO/lines/IMG_5874_output_27.png,su favor el mas bastante recibo y cecion de
/home/rpalomares/TFM/TFM-Docs-01-40-ALTO/lines/IMG_5885_output_08.png,Panale y Dn Juan Quintero vezinos de Cadiz=
/home/rpalomares/TFM/TFM-Docs-01-40-ALTO/lines/IMG_5867_output_30.png,La prima. encasa de los Sres. Counnont Bri-
/home/rpalomares/TFM/TFM-Docs-01-40-ALTO/lines/IMG_5897_output_02.png,"SELLO QVARTO, VEINTE"
/home/rpalomares/TFM/TFM-Docs-01-40-ALTO/lines/IMG_5896_output_15.png,bio Escrita en Ydioma Extrangero que traducida al.
/home/rpalomares/TFM/TFM-Docs-01-40-ALTO/lines/IMG_5872_output_35.png,blones quatrocientos veinte y uno J. Joison. Laurent=
/home/rpalomares/TFM/TFM-Docs-01-40-ALTO/lines/IMG_5890_output_27.png,Cadiz
/home/rpalomares/TFM/TFM-Docs-01-40-ALTO/lines/IMG_5871_output_29.png,el mayor
/home/rpalomares/TFM/TFM-Docs-01-40-ALTO/lines/IMG_5885_output_09.png,Josef Rodriguez
/home/rpalomares/TFM/TFM-Docs-01-40-ALTO/lines/IMG_5874_output_05.png,un Doblones importe de la referida Letra con
/home/rpalomares/TFM/TFM-Docs-01-40-ALTO/lines/IMG_5892_output_28.png,Birmingham y diez y ocho de Febrero de mil setecientos
/home/rpalomares/TFM/TFM-Docs-01-40-ALTO/lines/IMG_5870_output_07.png,rado dijo q. si y q. ellas no las pagaba por
/home/rpalomares/TFM/TFM-Docs-01-40-ALTO/lines/IMG_5871_output_17.png,"las citadas Letras, con mas todos los gastos cam-"
/home/rpalomares/TFM/TFM-Docs-01-40-ALTO/lines/IMG_5864_output_18.png,do Dn. Guillermo Gordon ia representaci-
/home/rpalomares/TFM/TFM-Docs-01-40-ALTO/lines/IMG_5878_output_22.png,Letra
/home/rpalomares/TFM/TFM-Docs-01-40-ALTO/lines/IMG_5899_output_04.png,les requiera la pagen mediante la aceptacion que
/home/rpalomares/TFM/TFM-Docs-01-40-ALTO/lines/IMG_5886_output_07.png,Dn. Diego Duff
/home/rpalomares/TFM/TFM-Docs-01-40-ALTO/lines/IMG_5872_output_40.png,Padre valor en Cuenta Amiens veinte octubre
/home/rpalomares/TFM/TFM-Docs-01-40-ALTO/lines/IMG_5862_output_04.png,ta q. todos los daños perjuicios intereses cambios y re-
/home/rpalomares/TFM/TFM-Docs-01-40-ALTO/lines/IMG_5884_output_19.png,Cadiz por esta segunda deCambio no haviendolo hecho por la primera treinta
/home/rpalomares/TFM/TFM-Docs-01-40-ALTO/lines/IMG_5868_output_34.png,cientos noventa y dos: Son Doblones no-
/home/rpalomares/TFM/TFM-Docs-01-40-ALTO/lines/IMG_5865_output_24.png,"termino de los dos años, y las demas de este caso co-"
/home/rpalomares/TFM/TFM-Docs-01-40-ALTO/lines/IMG_5900_output_19.png,a la orden de nosotros mismos doscientas treinta y ocho libras onze
/home/rpalomares/TFM/TFM-Docs-01-40-ALTO/lines/IMG_5870_output_29.png,los primenores Sesenta y cinco Doblones; la
/home/rpalomares/TFM/TFM-Docs-01-40-ALTO/lines/IMG_5868_output_26.png,ta y dos: Duplein Laurent Chartelain y
/home/rpalomares/TFM/TFM-Docs-01-40-ALTO/lines/IMG_5897_output_18.png,Josef Rodrigez
/home/rpalomares/TFM/TFM-Docs-01-40-ALTO/lines/IMG_5896_output_14.png,"fe conozco, y me exibio una Letra primera de Cam-"
/home/rpalomares/TFM/TFM-Docs-01-40-ALTO/lines/IMG_5861_output_32.png,Aceptazn.
/home/rpalomares/TFM/TFM-Docs-01-40-ALTO/lines/IMG_5892_output_23.png,doy fee=
/home/rpalomares/TFM/TFM-Docs-01-40-ALTO/lines/IMG_5894_output_36.png,"requiera con ella a Dn. Santos Monastien, para"
/home/rpalomares/TFM/TFM-Docs-01-40-ALTO/lines/IMG_5884_output_26.png,de mil setecientos noventa y tres=Priout=Paguese a la orden delos Sres. Proun-
/home/rpalomares/TFM/TFM-Docs-01-40-ALTO/lines/IMG_5891_output_16.png,"e yo lo doy delo qe. va expresado en la forma qe. puedo, no lo"
/home/rpalomares/TFM/TFM-Docs-01-40-ALTO/lines/IMG_5891_output_02.png,"SELLO QVARTO, VEINTE"
/home/rpalomares/TFM/TFM-Docs-01-40-ALTO/lines/IMG_5866_output_01.png,Veinte maravedis
/home/rpalomares/TFM/TFM-Docs-01-40-ALTO/lines/IMG_5899_output_06.png,"do para ello en la misma, y de lo contrario se proteste"
/home/rpalomares/TFM/TFM-Docs-01-40-ALTO/lines/IMG_5861_output_37.png,Otro
/home/rpalomares/TFM/TFM-Docs-01-40-ALTO/lines/IMG_5874_output_07.png,derechos del anterior protesto y este instru-
/home/rpalomares/TFM/TFM-Docs-01-40-ALTO/lines/IMG_5886_output_24.png,viendolo hecho por la primera anuestra orden la suma demil ci-
/home/rpalomares/TFM/TFM-Docs-01-40-ALTO/lines/IMG_5898_output_13.png,tres Ante mi el Ynfrascripto
/home/rpalomares/TFM/TFM-Docs-01-40-ALTO/lines/IMG_5868_output_32.png,Levña
/home/rpalomares/TFM/TFM-Docs-01-40-ALTO/lines/IMG_5876_output_16.png,doy fe conozco y me exhivio dos Letras prime
/home/rpalomares/TFM/TFM-Docs-01-40-ALTO/lines/IMG_5890_output_19.png,"de cambio, segunda, y tercera de dicho tenor y fecha, no"
/home/rpalomares/TFM/TFM-Docs-01-40-ALTO/lines/IMG_5870_output_06.png,Comercio Counnant Bridel y Ca. el qe. ente-
/home/rpalomares/TFM/TFM-Docs-01-40-ALTO/lines/IMG_5863_output_37.png,Endoso
/home/rpalomares/TFM/TFM-Docs-01-40-ALTO/lines/IMG_5897_output_09.png,al tiempo del vencimiento del plazo de dicha Letra
/home/rpalomares/TFM/TFM-Docs-01-40-ALTO/lines/IMG_5880_output_10.png,Diego Duff vezino y del comercio de esta
/home/rpalomares/TFM/TFM-Docs-01-40-ALTO/lines/IMG_5889_output_27.png,Cadiz
/home/rpalomares/TFM/TFM-Docs-01-40-ALTO/lines/IMG_5863_output_16.png,miento de ella y testigos parecio
/home/rpalomares/TFM/TFM-Docs-01-40-ALTO/lines/IMG_5887_output_02.png,seau Baquenau y compa.= Paguese a la orden de Dn. Diego Duff va
/home/rpalomares/TFM/TFM-Docs-01-40-ALTO/lines/IMG_5878_output_02.png,"SELLO QVARTO, VEINTE"
/home/rpalomares/TFM/TFM-Docs-01-40-ALTO/lines/IMG_5861_output_07.png,Dn. Guillermo Gordon
/home/rpalomares/TFM/TFM-Docs-01-40-ALTO/lines/IMG_5869_output_07.png,biéndolo hecho pon la primera a nuestra
/home/rpalomares/TFM/TFM-Docs-01-40-ALTO/lines/IMG_5887_output_15.png,tada porque se le pregunta pero que esta presto a aceptar la
/home/rpalomares/TFM/TFM-Docs-01-40-ALTO/lines/IMG_5870_output_02.png,ner fondos del Librador: esto dio p. su repues-
/home/rpalomares/TFM/TFM-Docs-01-40-ALTO/lines/IMG_5893_output_18.png,"sef de Castro, Dn. Juan Quintero, y Dn. Juan Panale"
/home/rpalomares/TFM/TFM-Docs-01-40-ALTO/lines/IMG_5882_output_26.png,y del comercio de esta dicha Plaza a fin de que
/home/rpalomares/TFM/TFM-Docs-01-40-ALTO/lines/IMG_5869_output_15.png,Bridel y Compañia.
/home/rpalomares/TFM/TFM-Docs-01-40-ALTO/lines/IMG_5884_output_33.png,"Y asi copiada dicha Letra y endosos el referido Dn. Diego Duff, me"
/home/rpalomares/TFM/TFM-Docs-01-40-ALTO/lines/IMG_5865_output_04.png,baxo de protesto y carta de pago C. honor de lo Sres. Ho-
/home/rpalomares/TFM/TFM-Docs-01-40-ALTO/lines/IMG_5876_output_46.png,enterado dijo no las aceptava por cuenta dequien fueron libradas por no
/home/rpalomares/TFM/TFM-Docs-01-40-ALTO/lines/IMG_5873_output_13.png,Miguel Maria Chacopineli contra quien biene libra-
/home/rpalomares/TFM/TFM-Docs-01-40-ALTO/lines/IMG_5882_output_32.png,"Ecrivano pase alas Casas del Dn. Pedro Fouan, y ha-"
/home/rpalomares/TFM/TFM-Docs-01-40-ALTO/lines/IMG_5900_output_41.png,halla lugar sobre que dixo hacia los protestos en esta ra
/home/rpalomares/TFM/TFM-Docs-01-40-ALTO/lines/IMG_5871_output_09.png,"renuncia, la ecepcion de la non mumena-"
/home/rpalomares/TFM/TFM-Docs-01-40-ALTO/lines/IMG_5898_output_01.png,Veinte maravedis.
/home/rpalomares/TFM/TFM-Docs-01-40-ALTO/lines/IMG_5861_output_43.png,benta y dos= Boyd Kei y Compa.
/home/rpalomares/TFM/TFM-Docs-01-40-ALTO/lines/IMG_5864_output_25.png,perdidas intereses gastos camvios y recambios
/home/rpalomares/TFM/TFM-Docs-01-40-ALTO/lines/IMG_5876_output_32.png,de aocho reales plata auno y medio vso pague Vmd. esta primera de cambio ala
/home/rpalomares/TFM/TFM-Docs-01-40-ALTO/lines/IMG_5890_output_37.png,don me pidio la presente original a los Señores Barny
/home/rpalomares/TFM/TFM-Docs-01-40-ALTO/lines/IMG_5882_output_05.png,En la Ciudad de Cadiz a diez y nueve di
/home/rpalomares/TFM/TFM-Docs-01-40-ALTO/lines/IMG_5883_output_01.png,Veinte maravedis.
/home/rpalomares/TFM/TFM-Docs-01-40-ALTO/lines/IMG_5867_output_07.png,del mes de Enero del año de
/home/rpalomares/TFM/TFM-Docs-01-40-ALTO/lines/IMG_5884_output_06.png,En la Ciudad de Cadiz a veinte y un dias del
/home/rpalomares/TFM/TFM-Docs-01-40-ALTO/lines/IMG_5861_output_12.png,entos noventa y tres ante mi el In-
/home/rpalomares/TFM/TFM-Docs-01-40-ALTO/lines/IMG_5887_output_17.png,protesto. Esto dio por su respuesta no obstante lo qual el requiren
/home/rpalomares/TFM/TFM-Docs-01-40-ALTO/lines/IMG_5861_output_03.png,MARAVEDIS AÑO DE MIL
/home/rpalomares/TFM/TFM-Docs-01-40-ALTO/lines/IMG_5893_output_06.png,el Essno. la hize preste. y requeri con la citada Letra
/home/rpalomares/TFM/TFM-Docs-01-40-ALTO/lines/IMG_5894_output_17.png,"Dumas, vezino y del Comercio de esta Plaza a qn."
/home/rpalomares/TFM/TFM-Docs-01-40-ALTO/lines/IMG_5890_output_16.png,Letra deCambio por Libras seiscientas y cinquenta Sterlinas
/home/rpalomares/TFM/TFM-Docs-01-40-ALTO/lines/IMG_5864_output_01.png,SSres. Amsterdam cinco de Noviembre de mil se-
/home/rpalomares/TFM/TFM-Docs-01-40-ALTO/lines/IMG_5875_output_04.png,SETECIENTOS NOVENTA Y
/home/rpalomares/TFM/TFM-Docs-01-40-ALTO/lines/IMG_5871_output_21.png,brando todas las diligas. actos y Autos q. preziso Sea
/home/rpalomares/TFM/TFM-Docs-01-40-ALTO/lines/IMG_5867_output_11.png,del cavildo y Ayuntami-
/home/rpalomares/TFM/TFM-Docs-01-40-ALTO/lines/IMG_5865_output_30.png,"el medio, y en la forma qe. mas les convengan, y to-"
/home/rpalomares/TFM/TFM-Docs-01-40-ALTO/lines/IMG_5875_output_12.png,Guillermo Gordon
/home/rpalomares/TFM/TFM-Docs-01-40-ALTO/lines/IMG_5894_output_16.png,ella y testigos parecio Dn. Franco.
/home/rpalomares/TFM/TFM-Docs-01-40-ALTO/lines/IMG_5881_output_17.png,mayor abundamto. seda p. contento y entregado asu voluntad con renuncia. delas leyes del
/home/rpalomares/TFM/TFM-Docs-01-40-ALTO/lines/IMG_5871_output_26.png,algo.: Yassi lo dijo otorgó y firmó siendo Testigos los
/home/rpalomares/TFM/TFM-Docs-01-40-ALTO/lines/IMG_5892_output_36.png,Paguese a la orden de los Sres. Dn. Diego Suton y compa. a cur-
/home/rpalomares/TFM/TFM-Docs-01-40-ALTO/lines/IMG_5870_output_01.png,"co Pio, el que expuso no las pagava pr. no te-"
/home/rpalomares/TFM/TFM-Docs-01-40-ALTO/lines/IMG_5869_output_22.png,la orden del Sres. Dn. Andres Lacasaigne el mayor
/home/rpalomares/TFM/TFM-Docs-01-40-ALTO/lines/IMG_5880_output_34.png,nado en la misma para ello y deno hacerlo le proteste que todos
/home/rpalomares/TFM/TFM-Docs-01-40-ALTO/lines/IMG_5884_output_20.png,y ocho doblenes veinte y tres reales de plata y tres maravedis de plata valor
/home/rpalomares/TFM/TFM-Docs-01-40-ALTO/lines/IMG_5863_output_13.png,mil setecientos noventa y tres
/home/rpalomares/TFM/TFM-Docs-01-40-ALTO/lines/IMG_5889_output_05.png,"ten de todos los daños, perjuicios, cambios, recambios, y"
/home/rpalomares/TFM/TFM-Docs-01-40-ALTO/lines/IMG_5861_output_34.png,Walhs
/home/rpalomares/TFM/TFM-Docs-01-40-ALTO/lines/IMG_5865_output_26.png,en forma ; Sediendo en favor de los expresados Sres.
/home/rpalomares/TFM/TFM-Docs-01-40-ALTO/lines/IMG_5869_output_14.png,La primera en casa de los Sres. Counneant.
/home/rpalomares/TFM/TFM-Docs-01-40-ALTO/lines/IMG_5863_output_36.png,quiluz y Ca. de Cadiz Josef Colom e Hijos=Paguese
/home/rpalomares/TFM/TFM-Docs-01-40-ALTO/lines/IMG_5876_output_18.png,gero que traducidas al castellano su te
/home/rpalomares/TFM/TFM-Docs-01-40-ALTO/lines/IMG_5898_output_28.png,y Apto contodos. = Nicolas Sannaille y Compañia=
/home/rpalomares/TFM/TFM-Docs-01-40-ALTO/lines/IMG_5895_output_11.png,de Burum
/home/rpalomares/TFM/TFM-Docs-01-40-ALTO/lines/IMG_5878_output_30.png,y Guillermo Fos Ketl: Sevilla pagadera en Cadiz
/home/rpalomares/TFM/TFM-Docs-01-40-ALTO/lines/IMG_5900_output_14.png,que la misma contiene es su tenor como Sigue
/home/rpalomares/TFM/TFM-Docs-01-40-ALTO/lines/IMG_5874_output_28.png,acciones que corresponda con las fuerzas
/home/rpalomares/TFM/TFM-Docs-01-40-ALTO/lines/IMG_5876_output_48.png,man de Dunsmure su librador vajo el protesto correspondiente esto dio
/home/rpalomares/TFM/TFM-Docs-01-40-ALTO/lines/IMG_5896_output_36.png,virtud Yo el Essno. mostré la sitada Letra al men-
/home/rpalomares/TFM/TFM-Docs-01-40-ALTO/lines/IMG_5868_output_06.png,venta y dos=Foulton y Rauel
/home/rpalomares/TFM/TFM-Docs-01-40-ALTO/lines/IMG_5891_output_04.png,SETECIENTOS NOVENTA Y
/home/rpalomares/TFM/TFM-Docs-01-40-ALTO/lines/IMG_5862_output_15.png,incenta requerido con dicha Letra Dn. Juan Walsh
/home/rpalomares/TFM/TFM-Docs-01-40-ALTO/lines/IMG_5863_output_15.png,y mayor del cavildo y Ayunta-
/home/rpalomares/TFM/TFM-Docs-01-40-ALTO/lines/IMG_5897_output_11.png,por su respuesta no obstante la qual el requirente
/home/rpalomares/TFM/TFM-Docs-01-40-ALTO/lines/IMG_5880_output_24.png,Maria Aliceni= A los Sres. Dn Juan Bosco Peñasco de la Cerda
/home/rpalomares/TFM/TFM-Docs-01-40-ALTO/lines/IMG_5880_output_09.png,cripto Essno. Publico y testigos parecio Dn.
/home/rpalomares/TFM/TFM-Docs-01-40-ALTO/lines/IMG_5900_output_34.png,Londres Vt Supra= Diego Suton y Compañia
/home/rpalomares/TFM/TFM-Docs-01-40-ALTO/lines/IMG_5894_output_15.png,del Cavildo y Ayuntamiento de
/home/rpalomares/TFM/TFM-Docs-01-40-ALTO/lines/IMG_5864_output_16.png,Prosigue
/home/rpalomares/TFM/TFM-Docs-01-40-ALTO/lines/IMG_5861_output_29.png,dia. Sres. de Chapeaurouge y Compañia=Al Sor. Dn. Clemen-
/home/rpalomares/TFM/TFM-Docs-01-40-ALTO/lines/IMG_5884_output_22.png,Vallet= a Dn. Josef Pedro Tonices negociante en la Coruña pagadera en Cadiz
/home/rpalomares/TFM/TFM-Docs-01-40-ALTO/lines/IMG_5867_output_23.png,no haviendolo hecho pon la primera a nu-
/home/rpalomares/TFM/TFM-Docs-01-40-ALTO/lines/IMG_5895_output_08.png,"Quintero Dn. Josef de Castro, y Dn. Franco. Pe-"
/home/rpalomares/TFM/TFM-Docs-01-40-ALTO/lines/IMG_5888_output_29.png,"treinta, y nueve libras Esterlinas y un sueldo al cam-"
/home/rpalomares/TFM/TFM-Docs-01-40-ALTO/lines/IMG_5881_output_13.png,Ynmediatamte. dho dn. diego Duff dijo se hacia pago en si mismo delos dos mil quatroci-
/home/rpalomares/TFM/TFM-Docs-01-40-ALTO/lines/IMG_5882_output_04.png,Dn. Pedro Fouan
/home/rpalomares/TFM/TFM-Docs-01-40-ALTO/lines/IMG_5880_output_22.png,ta y cinco de aocho reales deplata antigua cada uno valor de los
/home/rpalomares/TFM/TFM-Docs-01-40-ALTO/lines/IMG_5881_output_25.png,zas y firmezas pa. su validacion necesarias sin quedan como no que-
/home/rpalomares/TFM/TFM-Docs-01-40-ALTO/lines/IMG_5863_output_03.png,"MARAVEDIS, AÑO DE MIL"
/home/rpalomares/TFM/TFM-Docs-01-40-ALTO/lines/IMG_5863_output_12.png,dias del mes de Enero del año de
/home/rpalomares/TFM/TFM-Docs-01-40-ALTO/lines/IMG_5882_output_10.png,testigos parecio Dn. Pedro Paynaud vezi-
/home/rpalomares/TFM/TFM-Docs-01-40-ALTO/lines/IMG_5869_output_21.png,sin Lainnent Chartelain y Compa.= Paguese a
/home/rpalomares/TFM/TFM-Docs-01-40-ALTO/lines/IMG_5892_output_31.png,prima. de canvio a la orden de los Ss. vanden Meulen y Joi-
/home/rpalomares/TFM/TFM-Docs-01-40-ALTO/lines/IMG_5876_output_12.png,noventa y tres. ante mi el Ynfrascripto Essno.
/home/rpalomares/TFM/TFM-Docs-01-40-ALTO/lines/IMG_5881_output_29.png,Diego Duff
/home/rpalomares/TFM/TFM-Docs-01-40-ALTO/lines/IMG_5892_output_06.png,Protesto
/home/rpalomares/TFM/TFM-Docs-01-40-ALTO/lines/IMG_5861_output_40.png,Otro
/home/rpalomares/TFM/TFM-Docs-01-40-ALTO/lines/IMG_5864_output_29.png,zon necesario Eyo el Esso. la hize presente
/home/rpalomares/TFM/TFM-Docs-01-40-ALTO/lines/IMG_5864_output_23.png,luego y sin dilacion alguna lacantidad devida
/home/rpalomares/TFM/TFM-Docs-01-40-ALTO/lines/IMG_5868_output_24.png,"el, valor en quenta: San Quintin Ca-"
/home/rpalomares/TFM/TFM-Docs-01-40-ALTO/lines/IMG_5870_output_24.png,Inmediatamente. el referido Dn. Andres
/home/rpalomares/TFM/TFM-Docs-01-40-ALTO/lines/IMG_5892_output_30.png,y dos dineros Sterlinas. A noventa dias fha. paguese p. esta
/home/rpalomares/TFM/TFM-Docs-01-40-ALTO/lines/IMG_5888_output_24.png,"Essem cinco de Febrero de mil setecientos noventa, y"
/home/rpalomares/TFM/TFM-Docs-01-40-ALTO/lines/IMG_5867_output_24.png,estra orden la cantidad de Setenta y cinco
/home/rpalomares/TFM/TFM-Docs-01-40-ALTO/lines/IMG_5888_output_28.png,Juan y Francisco Vaniny y Compañia trescientas
/home/rpalomares/TFM/TFM-Docs-01-40-ALTO/lines/IMG_5870_output_22.png,Recibo y Ce
/home/rpalomares/TFM/TFM-Docs-01-40-ALTO/lines/IMG_5888_output_02.png,"SELLO QVARTO, VEINTE"
/home/rpalomares/TFM/TFM-Docs-01-40-ALTO/lines/IMG_5881_output_34.png,Cno. puco.
/home/rpalomares/TFM/TFM-Docs-01-40-ALTO/lines/IMG_5899_output_11.png,Letra a dhos Señores e hize el requerimiento y protestas
/home/rpalomares/TFM/TFM-Docs-01-40-ALTO/lines/IMG_5898_output_09.png,Los Sres. Lannes Hermanos
/home/rpalomares/TFM/TFM-Docs-01-40-ALTO/lines/IMG_5878_output_06.png,Protesto de Letra
/home/rpalomares/TFM/TFM-Docs-01-40-ALTO/lines/IMG_5870_output_04.png,tras comprehende y requeri con ellas auno
