0,1
/home/rpalomares/TFM/TFM-Docs-01-40-ALTO/lines/IMG_5876_output_34.png,plata por pesos valor del mismo que anotara vmd. segun avisado: Aiosman
/home/rpalomares/TFM/TFM-Docs-01-40-ALTO/lines/IMG_5894_output_26.png,y dos Rs. de plata vieja. A noventa dias delafe-
/home/rpalomares/TFM/TFM-Docs-01-40-ALTO/lines/IMG_5890_output_15.png,comprehende es el siguiente.
/home/rpalomares/TFM/TFM-Docs-01-40-ALTO/lines/IMG_5880_output_19.png,les plata viejos: A noventa dias fecha pagara vmd. por
/home/rpalomares/TFM/TFM-Docs-01-40-ALTO/lines/IMG_5869_output_31.png,"pague y de lo contrario las proteste, que todos"
/home/rpalomares/TFM/TFM-Docs-01-40-ALTO/lines/IMG_5879_output_11.png,Josef Rodriguez
/home/rpalomares/TFM/TFM-Docs-01-40-ALTO/lines/IMG_5892_output_39.png,de otros Sres.= Ferndo. Vande Ateulen y Joivett.= Paguese a
/home/rpalomares/TFM/TFM-Docs-01-40-ALTO/lines/IMG_5868_output_16.png,pasaron Vmds. segn. el abiso de= Duplesin Lau-
/home/rpalomares/TFM/TFM-Docs-01-40-ALTO/lines/IMG_5862_output_16.png,comercio dijo estar fo de
/home/rpalomares/TFM/TFM-Docs-01-40-ALTO/lines/IMG_5884_output_40.png,virtud yo el Escrivano lo hize presente y requeri con la
/home/rpalomares/TFM/TFM-Docs-01-40-ALTO/lines/IMG_5865_output_16.png,Letra de los expresados setecientos y sesenta
/home/rpalomares/TFM/TFM-Docs-01-40-ALTO/lines/IMG_5896_output_09.png,ta y tres Ante mi el Ynfrascrip-
/home/rpalomares/TFM/TFM-Docs-01-40-ALTO/lines/IMG_5884_output_08.png,venta y tres ante mi el Ynfrascripto Essno. p.
/home/rpalomares/TFM/TFM-Docs-01-40-ALTO/lines/IMG_5889_output_22.png,los Señores primeros endosantes. Y el citado Dn. Diego Duff
/home/rpalomares/TFM/TFM-Docs-01-40-ALTO/lines/IMG_5876_output_35.png,Dunsmure. a Dn. Diego Duff. en Cadiz
/home/rpalomares/TFM/TFM-Docs-01-40-ALTO/lines/IMG_5899_output_21.png,Josef Rodriguez
/home/rpalomares/TFM/TFM-Docs-01-40-ALTO/lines/IMG_5880_output_21.png,Bramesel y Compañia pesos dos mil quatrocientos cinquen-
/home/rpalomares/TFM/TFM-Docs-01-40-ALTO/lines/IMG_5894_output_04.png,SETECIENTOS NOVENTA Y
/home/rpalomares/TFM/TFM-Docs-01-40-ALTO/lines/IMG_5878_output_42.png,"ven cumplido el plazo asignado en ella para ello, y en su de-"
/home/rpalomares/TFM/TFM-Docs-01-40-ALTO/lines/IMG_5863_output_11.png,Enla ciudad de Cadiz a siete
/home/rpalomares/TFM/TFM-Docs-01-40-ALTO/lines/IMG_5878_output_26.png,la orden delos Señores Dubois y Hijos setecientos pesos dea ciento ve-
/home/rpalomares/TFM/TFM-Docs-01-40-ALTO/lines/IMG_5889_output_15.png,sus protestos y mediante la indicacion que compren-
/home/rpalomares/TFM/TFM-Docs-01-40-ALTO/lines/IMG_5867_output_06.png,En la Ciudad de Cadiz a diez dias
/home/rpalomares/TFM/TFM-Docs-01-40-ALTO/lines/IMG_5898_output_10.png,En la Ciudad de Cadiz a veinte
/home/rpalomares/TFM/TFM-Docs-01-40-ALTO/lines/IMG_5897_output_07.png,aceptava por los Embargos que se le han echo
/home/rpalomares/TFM/TFM-Docs-01-40-ALTO/lines/IMG_5879_output_05.png,"ner aviso del aceptante, esto dio por su respuesta no"
/home/rpalomares/TFM/TFM-Docs-01-40-ALTO/lines/IMG_5890_output_03.png,Contra
/home/rpalomares/TFM/TFM-Docs-01-40-ALTO/lines/IMG_5892_output_26.png,"llano con los endosos, qe. la misma comprehende su tenor"
/home/rpalomares/TFM/TFM-Docs-01-40-ALTO/lines/IMG_5874_output_06.png,mas veinte y quatro reales de Plata de los
/home/rpalomares/TFM/TFM-Docs-01-40-ALTO/lines/IMG_5887_output_07.png,tes y compañia para que mediante la indicacion que contiene en-
/home/rpalomares/TFM/TFM-Docs-01-40-ALTO/lines/IMG_5877_output_03.png,forma que puedo y por derecho me es permitido y no firmo por
/home/rpalomares/TFM/TFM-Docs-01-40-ALTO/lines/IMG_5893_output_19.png,vecinos de Cadiz
/home/rpalomares/TFM/TFM-Docs-01-40-ALTO/lines/IMG_5861_output_33.png,Acepto vafo de protesto por onor delos Sacadores=Juan
/home/rpalomares/TFM/TFM-Docs-01-40-ALTO/lines/IMG_5882_output_09.png,vildo y Ayuntamiento de esta Plaza y
/home/rpalomares/TFM/TFM-Docs-01-40-ALTO/lines/IMG_5892_output_05.png,TRES.
/home/rpalomares/TFM/TFM-Docs-01-40-ALTO/lines/IMG_5890_output_11.png,"y del Comercio de esta Plaza, y por si -"
/home/rpalomares/TFM/TFM-Docs-01-40-ALTO/lines/IMG_5889_output_07.png,"entera satisfaccion seran de su cuenta, y de quien"
/home/rpalomares/TFM/TFM-Docs-01-40-ALTO/lines/IMG_5873_output_31.png,Recivo
/home/rpalomares/TFM/TFM-Docs-01-40-ALTO/lines/IMG_5864_output_04.png,Paguese ala orden de los Sres. Juan y George
/home/rpalomares/TFM/TFM-Docs-01-40-ALTO/lines/IMG_5880_output_42.png,ma que puedo y por derecho me es permitido que
/home/rpalomares/TFM/TFM-Docs-01-40-ALTO/lines/IMG_5889_output_17.png,Agustin Butlem como apoderado general de Dn.
/home/rpalomares/TFM/TFM-Docs-01-40-ALTO/lines/IMG_5876_output_29.png,Baechm y Compañia
/home/rpalomares/TFM/TFM-Docs-01-40-ALTO/lines/IMG_5890_output_30.png,Sirvase Vmd. pagar a Los Señores Dimsdale y Clays o or-
/home/rpalomares/TFM/TFM-Docs-01-40-ALTO/lines/IMG_5872_output_36.png,Al señor Dn. Miguel Maria Chacopineli Comercian-
/home/rpalomares/TFM/TFM-Docs-01-40-ALTO/lines/IMG_5900_output_07.png,"setecientos noventa, y tres Ante mi"
/home/rpalomares/TFM/TFM-Docs-01-40-ALTO/lines/IMG_5876_output_39.png,Y asi copiadas dichas Letras y endosos el referido Dn Juan Monphy me pidio las
/home/rpalomares/TFM/TFM-Docs-01-40-ALTO/lines/IMG_5874_output_11.png,nuncio la ecepcion dela non numerata pe-
/home/rpalomares/TFM/TFM-Docs-01-40-ALTO/lines/IMG_5868_output_11.png,"ta dias fecha, pague Vmds. por esta Seg. den"
/home/rpalomares/TFM/TFM-Docs-01-40-ALTO/lines/IMG_5888_output_17.png,ella y testigos parecio Dn. Diego
/home/rpalomares/TFM/TFM-Docs-01-40-ALTO/lines/IMG_5882_output_16.png,"pesos mil seiscientos treinta y tres, quatro y diez y nueve mas dea"
/home/rpalomares/TFM/TFM-Docs-01-40-ALTO/lines/IMG_5861_output_09.png,Dn. Clemente Lopez
/home/rpalomares/TFM/TFM-Docs-01-40-ALTO/lines/IMG_5900_output_01.png,Protesto de Letra
/home/rpalomares/TFM/TFM-Docs-01-40-ALTO/lines/IMG_5862_output_13.png,melo pidio pon testimonio e yo doy delo que dicho es co-
/home/rpalomares/TFM/TFM-Docs-01-40-ALTO/lines/IMG_5899_output_15.png,respuesta no obstante la qual el requirente se
/home/rpalomares/TFM/TFM-Docs-01-40-ALTO/lines/IMG_5894_output_20.png,"trangero, que traducida al Castellano, su thenor"
/home/rpalomares/TFM/TFM-Docs-01-40-ALTO/lines/IMG_5883_output_08.png,Juan Quintero vezinos de Cadiz
/home/rpalomares/TFM/TFM-Docs-01-40-ALTO/lines/IMG_5888_output_31.png,que pagaran en cuenta segun aviso de sus venosdonen=
/home/rpalomares/TFM/TFM-Docs-01-40-ALTO/lines/IMG_5889_output_13.png,las razones que escrive al Librador esto dio por Su res-
/home/rpalomares/TFM/TFM-Docs-01-40-ALTO/lines/IMG_5892_output_33.png,"lines, y dos dineros valor en cuenta qe. pasaré segn. aviso de"
/home/rpalomares/TFM/TFM-Docs-01-40-ALTO/lines/IMG_5893_output_01.png,gen cumpdo. qe. sea su plazo y de lo contrario les pro-
/home/rpalomares/TFM/TFM-Docs-01-40-ALTO/lines/IMG_5886_output_26.png,setenta y cinco mas de plata por ducado valor denosotros mismos que
/home/rpalomares/TFM/TFM-Docs-01-40-ALTO/lines/IMG_5878_output_24.png,por pesos setecientos dea ciento veinte y ocho quartos cada peso.
/home/rpalomares/TFM/TFM-Docs-01-40-ALTO/lines/IMG_5866_output_08.png,necesarias para su validacion sin quedan como
/home/rpalomares/TFM/TFM-Docs-01-40-ALTO/lines/IMG_5873_output_14.png,"da afin que la acepte, y deno hacenlo le proteste qe."
/home/rpalomares/TFM/TFM-Docs-01-40-ALTO/lines/IMG_5878_output_34.png,Endoso
/home/rpalomares/TFM/TFM-Docs-01-40-ALTO/lines/IMG_5900_output_24.png,ung a quienes se acudira en caso de necesidad; u bien a los Sres.
/home/rpalomares/TFM/TFM-Docs-01-40-ALTO/lines/IMG_5898_output_29.png,A los Señores Lammes Hermanos Cadiz.
/home/rpalomares/TFM/TFM-Docs-01-40-ALTO/lines/IMG_5900_output_06.png,dias del mes de Marzo del año de mil
/home/rpalomares/TFM/TFM-Docs-01-40-ALTO/lines/IMG_5868_output_19.png,Yndican.
/home/rpalomares/TFM/TFM-Docs-01-40-ALTO/lines/IMG_5890_output_09.png,de su cavildo y Ayuntamiento y testi-
/home/rpalomares/TFM/TFM-Docs-01-40-ALTO/lines/IMG_5868_output_12.png,"de cambio, no haviendolo hecho Cn. la"
/home/rpalomares/TFM/TFM-Docs-01-40-ALTO/lines/IMG_5894_output_08.png,Contra.
/home/rpalomares/TFM/TFM-Docs-01-40-ALTO/lines/IMG_5892_output_13.png,mayor del Cavdo. y Ayuntamto. de esta
/home/rpalomares/TFM/TFM-Docs-01-40-ALTO/lines/IMG_5881_output_30.png,En el reso. de Dn Josef Rodriguz. de Bustum
/home/rpalomares/TFM/TFM-Docs-01-40-ALTO/lines/IMG_5898_output_12.png,año de mil setecientos noventa y
/home/rpalomares/TFM/TFM-Docs-01-40-ALTO/lines/IMG_5900_output_37.png,"tra quien biene librada a fin de que la acepte llanamente, y"
/home/rpalomares/TFM/TFM-Docs-01-40-ALTO/lines/IMG_5873_output_20.png,Miguel el qe. enterado dijo. no la aceptava p. las mismas
/home/rpalomares/TFM/TFM-Docs-01-40-ALTO/lines/IMG_5867_output_35.png,octubre de mil Setecientos noventa y dos=Lau-
/home/rpalomares/TFM/TFM-Docs-01-40-ALTO/lines/IMG_5881_output_24.png,mas bastante recibo y cecion de acciones qe. se necesite con las fuer-
/home/rpalomares/TFM/TFM-Docs-01-40-ALTO/lines/IMG_5870_output_16.png,otro es en la forma qe. puedo no firmo p. de-
/home/rpalomares/TFM/TFM-Docs-01-40-ALTO/lines/IMG_5898_output_27.png,Landuche sentandolos en cuenta como por abiso
/home/rpalomares/TFM/TFM-Docs-01-40-ALTO/lines/IMG_5884_output_18.png,inta y ocho veinte y tres reales tres mas. a nobenta dias fecha pagara vmd. en
/home/rpalomares/TFM/TFM-Docs-01-40-ALTO/lines/IMG_5887_output_03.png,"lor en cuenta, Paris cinco febrero mil setecientos nobenta y tres="
/home/rpalomares/TFM/TFM-Docs-01-40-ALTO/lines/IMG_5889_output_23.png,me pidió serlo de todo por testimonio como lo ejecuto en la
/home/rpalomares/TFM/TFM-Docs-01-40-ALTO/lines/IMG_5881_output_21.png,nada letra con mas todos los gastos cambios recambios seguidos y q. se causaren hasta
/home/rpalomares/TFM/TFM-Docs-01-40-ALTO/lines/IMG_5894_output_02.png,"SELLO QVARTO, VEINTE"
/home/rpalomares/TFM/TFM-Docs-01-40-ALTO/lines/IMG_5899_output_19.png,"ron testigos Dn Josef Pelaez, dn Bernardo Gonza"
/home/rpalomares/TFM/TFM-Docs-01-40-ALTO/lines/IMG_5888_output_38.png,"tos noventa, y tres. Juan y Francisco Banin y Com-"
/home/rpalomares/TFM/TFM-Docs-01-40-ALTO/lines/IMG_5878_output_19.png,exhivio una Letra primera de Cambio
/home/rpalomares/TFM/TFM-Docs-01-40-ALTO/lines/IMG_5864_output_14.png,"Paris aquince de Diciembre, de mil seteci-"
/home/rpalomares/TFM/TFM-Docs-01-40-ALTO/lines/IMG_5862_output_03.png,alguna la cantidad desu valor y de lo contrario le protes-
/home/rpalomares/TFM/TFM-Docs-01-40-ALTO/lines/IMG_5879_output_03.png,el requerimiento y p no tenta referido: enterado Dijo por
/home/rpalomares/TFM/TFM-Docs-01-40-ALTO/lines/IMG_5872_output_27.png,es el siguiente.
/home/rpalomares/TFM/TFM-Docs-01-40-ALTO/lines/IMG_5884_output_15.png,su tenor es el siguiente
/home/rpalomares/TFM/TFM-Docs-01-40-ALTO/lines/IMG_5887_output_18.png,te se afirmo en sus protestos me lo pidio por testimonio e yo
/home/rpalomares/TFM/TFM-Docs-01-40-ALTO/lines/IMG_5869_output_38.png,"el Essno. instrui, de todo al Dn. Francisco"
/home/rpalomares/TFM/TFM-Docs-01-40-ALTO/lines/IMG_5876_output_38.png,Prosigue
/home/rpalomares/TFM/TFM-Docs-01-40-ALTO/lines/IMG_5894_output_37.png,quela acepte llanamente a fin de pagarla
/home/rpalomares/TFM/TFM-Docs-01-40-ALTO/lines/IMG_5894_output_13.png,Ynfrascripto Essno. publico pro-
/home/rpalomares/TFM/TFM-Docs-01-40-ALTO/lines/IMG_5865_output_25.png,mo en ellas se contiene a de que otorgara recivo
/home/rpalomares/TFM/TFM-Docs-01-40-ALTO/lines/IMG_5897_output_14.png,no firmo el suso dicho por decir no ser necesario
/home/rpalomares/TFM/TFM-Docs-01-40-ALTO/lines/IMG_5876_output_11.png,del mes de Enero del año demil setecientos
/home/rpalomares/TFM/TFM-Docs-01-40-ALTO/lines/IMG_5864_output_09.png,SSres. Boyd Keny Ca. valor en quenta Londres
/home/rpalomares/TFM/TFM-Docs-01-40-ALTO/lines/IMG_5868_output_05.png,TRES.
/home/rpalomares/TFM/TFM-Docs-01-40-ALTO/lines/IMG_5886_output_05.png,TRES.
/home/rpalomares/TFM/TFM-Docs-01-40-ALTO/lines/IMG_5887_output_14.png,por quien entendida y vista dijo no ha recibido la primera acep
/home/rpalomares/TFM/TFM-Docs-01-40-ALTO/lines/IMG_5872_output_39.png,Paguese ala orden de Dn. Eduardo Bontemo-
/home/rpalomares/TFM/TFM-Docs-01-40-ALTO/lines/IMG_5900_output_08.png,el Ynfrascripto Essno. Publico y mayor del
/home/rpalomares/TFM/TFM-Docs-01-40-ALTO/lines/IMG_5876_output_47.png,tener fondos suyos en su poder y si lo hacia por onor a la firma de ellos
/home/rpalomares/TFM/TFM-Docs-01-40-ALTO/lines/IMG_5865_output_27.png,Hope y compa. todos sus dhos. y acciones q. le corres-
/home/rpalomares/TFM/TFM-Docs-01-40-ALTO/lines/IMG_5871_output_01.png,segunda en ochenta y tres con doze Reales
/home/rpalomares/TFM/TFM-Docs-01-40-ALTO/lines/IMG_5864_output_22.png,"que lamisma compreende, afin q la paguen"
/home/rpalomares/TFM/TFM-Docs-01-40-ALTO/lines/IMG_5872_output_03.png,"SELLO QVARTO, VEINTE"
/home/rpalomares/TFM/TFM-Docs-01-40-ALTO/lines/IMG_5864_output_11.png,otro
/home/rpalomares/TFM/TFM-Docs-01-40-ALTO/lines/IMG_5875_output_07.png,"validacion sin quedan como no queda,"
/home/rpalomares/TFM/TFM-Docs-01-40-ALTO/lines/IMG_5870_output_05.png,de los Socios de la compañia Titulada en este
/home/rpalomares/TFM/TFM-Docs-01-40-ALTO/lines/IMG_5888_output_21.png,crita en Ydioma Estrangero que traducida al Cas-
/home/rpalomares/TFM/TFM-Docs-01-40-ALTO/lines/IMG_5887_output_06.png,dio la presente original y requiera con ella a los Sres. Lecutein Despon.
/home/rpalomares/TFM/TFM-Docs-01-40-ALTO/lines/IMG_5884_output_09.png,y mayor del Cavildo y Ayuntamiento de ella
/home/rpalomares/TFM/TFM-Docs-01-40-ALTO/lines/IMG_5868_output_04.png,SETECIENTOS NOVENTA Y
/home/rpalomares/TFM/TFM-Docs-01-40-ALTO/lines/IMG_5891_output_14.png,la mayor parte: esto dio por su respuesta no obstante la qual el
/home/rpalomares/TFM/TFM-Docs-01-40-ALTO/lines/IMG_5864_output_33.png,venido el sujeto q. la havia puesto
/home/rpalomares/TFM/TFM-Docs-01-40-ALTO/lines/IMG_5865_output_07.png,Dn. Rafael de los Ríos y Dn. Juan Quintero vezinos de
/home/rpalomares/TFM/TFM-Docs-01-40-ALTO/lines/IMG_5864_output_07.png,otro
/home/rpalomares/TFM/TFM-Docs-01-40-ALTO/lines/IMG_5865_output_01.png,testim. eyo lo doy de lo q dho es y de q el
/home/rpalomares/TFM/TFM-Docs-01-40-ALTO/lines/IMG_5869_output_11.png,sim Laurent Chartelain y Compañia. A Dn.
/home/rpalomares/TFM/TFM-Docs-01-40-ALTO/lines/IMG_5865_output_09.png,Josef Rodriguez
/home/rpalomares/TFM/TFM-Docs-01-40-ALTO/lines/IMG_5874_output_26.png,como fuera de el sobre que otorgava en y
/home/rpalomares/TFM/TFM-Docs-01-40-ALTO/lines/IMG_5894_output_39.png,teste que todos los daños perdidas intereses gastos
/home/rpalomares/TFM/TFM-Docs-01-40-ALTO/lines/IMG_5889_output_12.png,"por si, y en nombre de la misma no la aceptava por"
/home/rpalomares/TFM/TFM-Docs-01-40-ALTO/lines/IMG_5878_output_36.png,con el dicho vt retro= Dubois e Hijos
/home/rpalomares/TFM/TFM-Docs-01-40-ALTO/lines/IMG_5875_output_08.png,"obligado asaneamiento alguno, y asi lo dijo"
/home/rpalomares/TFM/TFM-Docs-01-40-ALTO/lines/IMG_5889_output_08.png,mas haya lugar; en cuya virtud Yo el Escrivano mos-
/home/rpalomares/TFM/TFM-Docs-01-40-ALTO/lines/IMG_5897_output_12.png,se afirmó en su protesto me lo pidio por testimonio
/home/rpalomares/TFM/TFM-Docs-01-40-ALTO/lines/IMG_5894_output_05.png,TRES.
/home/rpalomares/TFM/TFM-Docs-01-40-ALTO/lines/IMG_5870_output_11.png,"importe de las enunciadas Letras, p. onor"
/home/rpalomares/TFM/TFM-Docs-01-40-ALTO/lines/IMG_5896_output_30.png,"Beltena, y Compañia contra quien viene librada"
/home/rpalomares/TFM/TFM-Docs-01-40-ALTO/lines/IMG_5873_output_27.png,"el delos Rios, y Dn Juan Panabe vezinos de"
/home/rpalomares/TFM/TFM-Docs-01-40-ALTO/lines/IMG_5864_output_34.png,cilio mediante temen aquel q repetir del
/home/rpalomares/TFM/TFM-Docs-01-40-ALTO/lines/IMG_5875_output_02.png,"SELLO QVARTO, VEINTE"
/home/rpalomares/TFM/TFM-Docs-01-40-ALTO/lines/IMG_5890_output_29.png,entos noventa y tres: Barny Padre Hijo y Compañia -
/home/rpalomares/TFM/TFM-Docs-01-40-ALTO/lines/IMG_5866_output_04.png,SETECTENTOS NOVE NTA Y
/home/rpalomares/TFM/TFM-Docs-01-40-ALTO/lines/IMG_5898_output_20.png,Laus Deo Malaga y Febrero doze de mil setecientos
/home/rpalomares/TFM/TFM-Docs-01-40-ALTO/lines/IMG_5896_output_35.png,"su cuenta, y de quien mas halla lugar en cuya"
/home/rpalomares/TFM/TFM-Docs-01-40-ALTO/lines/IMG_5876_output_01.png,Veinte maravedis.
/home/rpalomares/TFM/TFM-Docs-01-40-ALTO/lines/IMG_5889_output_24.png,firma que puedo no firmó por decir no ser necesario
/home/rpalomares/TFM/TFM-Docs-01-40-ALTO/lines/IMG_5896_output_23.png,"maravedis de treinta, y dos reales de plata vieja valor"
/home/rpalomares/TFM/TFM-Docs-01-40-ALTO/lines/IMG_5880_output_25.png,y Compañia de Malaga= en Cadiz pagadera al Domicilio de
/home/rpalomares/TFM/TFM-Docs-01-40-ALTO/lines/IMG_5864_output_31.png,entendida y vista dijo en nombre de su com-
/home/rpalomares/TFM/TFM-Docs-01-40-ALTO/lines/IMG_5886_output_28.png,Juan Binalet del Puerto de Sta. Maria pagadera en Cadiz
/home/rpalomares/TFM/TFM-Docs-01-40-ALTO/lines/IMG_5898_output_07.png,Dn. Diego Duff
/home/rpalomares/TFM/TFM-Docs-01-40-ALTO/lines/IMG_5871_output_19.png,"seguidos y que se siguieren, pr. el medio y en"
/home/rpalomares/TFM/TFM-Docs-01-40-ALTO/lines/IMG_5888_output_23.png,de su thenor es el siguiente
/home/rpalomares/TFM/TFM-Docs-01-40-ALTO/lines/IMG_5897_output_10.png,estuvieren alzados la aceptará y pagará esto dio
/home/rpalomares/TFM/TFM-Docs-01-40-ALTO/lines/IMG_5873_output_11.png,Y asi copiada otra Letra y endosos el requirente me
/home/rpalomares/TFM/TFM-Docs-01-40-ALTO/lines/IMG_5880_output_39.png,misma no la pagava por no tener aviso del indicante esto dio
/home/rpalomares/TFM/TFM-Docs-01-40-ALTO/lines/IMG_5893_output_21.png,de Burum
/home/rpalomares/TFM/TFM-Docs-01-40-ALTO/lines/IMG_5881_output_07.png,nos de Cadiz
/home/rpalomares/TFM/TFM-Docs-01-40-ALTO/lines/IMG_5863_output_19.png,doy fe conozco en voz y nombre de Dn. Diego Duff co-
/home/rpalomares/TFM/TFM-Docs-01-40-ALTO/lines/IMG_5894_output_25.png,"ce, cinco Reales, y veinte y nueve my. de treinta"
/home/rpalomares/TFM/TFM-Docs-01-40-ALTO/lines/IMG_5894_output_41.png,"su quenta y de quien mas haya lugar, sobre qe."
/home/rpalomares/TFM/TFM-Docs-01-40-ALTO/lines/IMG_5898_output_05.png,TRES.
/home/rpalomares/TFM/TFM-Docs-01-40-ALTO/lines/IMG_5883_output_10.png,de Burum
/home/rpalomares/TFM/TFM-Docs-01-40-ALTO/lines/IMG_5898_output_16.png,"y Testigos parecio Dn. Diego Duff Vezino, y del Co-"
/home/rpalomares/TFM/TFM-Docs-01-40-ALTO/lines/IMG_5863_output_28.png,cambio ala orden de los SSres. Pedro y Afs de Morbi-
/home/rpalomares/TFM/TFM-Docs-01-40-ALTO/lines/IMG_5865_output_06.png,nesesario y de todo fueron testigos Dn. Josef Pelaez
/home/rpalomares/TFM/TFM-Docs-01-40-ALTO/lines/IMG_5881_output_12.png,Cno. pu-
/home/rpalomares/TFM/TFM-Docs-01-40-ALTO/lines/IMG_5888_output_40.png,en cuenta. Londres de supra= Eduardo MacJulloch.
/home/rpalomares/TFM/TFM-Docs-01-40-ALTO/lines/IMG_5867_output_16.png,"en Idioma Extrangero, que traducidas al"
/home/rpalomares/TFM/TFM-Docs-01-40-ALTO/lines/IMG_5867_output_15.png,"bio, tres Letras Segundas de Cambio escritas"
/home/rpalomares/TFM/TFM-Docs-01-40-ALTO/lines/IMG_5879_output_09.png,"testigos Dn Josef Pelaez, Dn Josef de Castro Lopez de Trujillo"
/home/rpalomares/TFM/TFM-Docs-01-40-ALTO/lines/IMG_5893_output_15.png,"en sus protestos, me lo pidio pr. testimo. eyo lo doi de"
/home/rpalomares/TFM/TFM-Docs-01-40-ALTO/lines/IMG_5890_output_26.png,Barni Padre Hijo y compañia comerciantes
/home/rpalomares/TFM/TFM-Docs-01-40-ALTO/lines/IMG_5880_output_20.png,esta primera de cambio ala orden (vigusta) del Señor.
/home/rpalomares/TFM/TFM-Docs-01-40-ALTO/lines/IMG_5878_output_03.png,"MARAVEDIS, AÑO DE MIL"
/home/rpalomares/TFM/TFM-Docs-01-40-ALTO/lines/IMG_5874_output_01.png,Gordon por la representacion que le asiste Dijo
/home/rpalomares/TFM/TFM-Docs-01-40-ALTO/lines/IMG_5888_output_35.png,"y compañia al cambio de treinta, y cinco peniques"
/home/rpalomares/TFM/TFM-Docs-01-40-ALTO/lines/IMG_5886_output_04.png,SETECIENTOS NOVENTA Y
/home/rpalomares/TFM/TFM-Docs-01-40-ALTO/lines/IMG_5869_output_23.png,valor en quenta: Paris diez y siete de No-
/home/rpalomares/TFM/TFM-Docs-01-40-ALTO/lines/IMG_5864_output_13.png,alaorden de Dn. Diego Duff valor en quenta
/home/rpalomares/TFM/TFM-Docs-01-40-ALTO/lines/IMG_5863_output_07.png,Dn. Guillermo Gordon
/home/rpalomares/TFM/TFM-Docs-01-40-ALTO/lines/IMG_5872_output_25.png,"Duff como su Apoderado general, y me exhivio una"
/home/rpalomares/TFM/TFM-Docs-01-40-ALTO/lines/IMG_5886_output_14.png,cripto Essno. Publico y mayor del cavildo
/home/rpalomares/TFM/TFM-Docs-01-40-ALTO/lines/IMG_5897_output_16.png,ez Dn. Bernardo Gonzalez y Dn. Juan Quintero
/home/rpalomares/TFM/TFM-Docs-01-40-ALTO/lines/IMG_5873_output_01.png,Otro
/home/rpalomares/TFM/TFM-Docs-01-40-ALTO/lines/IMG_5876_output_23.png,esta primera de cambio a la orden delos señores dn. Edmund Bachm
/home/rpalomares/TFM/TFM-Docs-01-40-ALTO/lines/IMG_5878_output_16.png,y testigos parecio Dn. Josef Valladares vezi-
/home/rpalomares/TFM/TFM-Docs-01-40-ALTO/lines/IMG_5878_output_13.png,mes de Febrero del año demil setecientos
/home/rpalomares/TFM/TFM-Docs-01-40-ALTO/lines/IMG_5881_output_06.png,"Pelaez, Dn Josef de Castro y Dn Juan Panale, vezi-"
/home/rpalomares/TFM/TFM-Docs-01-40-ALTO/lines/IMG_5897_output_06.png,si y en nombre de su compañia no la
/home/rpalomares/TFM/TFM-Docs-01-40-ALTO/lines/IMG_5899_output_20.png,lez y Dn. Juan Quintero vezinos de Cadiz=
/home/rpalomares/TFM/TFM-Docs-01-40-ALTO/lines/IMG_5900_output_03.png,Contra
/home/rpalomares/TFM/TFM-Docs-01-40-ALTO/lines/IMG_5868_output_03.png,"MARAVEDIS, AÑO DE MIL"
/home/rpalomares/TFM/TFM-Docs-01-40-ALTO/lines/IMG_5876_output_26.png,re a Dn. Diego Duff. en Cadiz
/home/rpalomares/TFM/TFM-Docs-01-40-ALTO/lines/IMG_5896_output_28.png,"mas portador de ella me pidio la presente original,"
/home/rpalomares/TFM/TFM-Docs-01-40-ALTO/lines/IMG_5865_output_29.png,"tes, y sus vienes el importe de la citada Letra por"
/home/rpalomares/TFM/TFM-Docs-01-40-ALTO/lines/IMG_5890_output_17.png,Boston veinte y uno de Noviembre mil setecientos no-
/home/rpalomares/TFM/TFM-Docs-01-40-ALTO/lines/IMG_5882_output_24.png,Pedro Raynaud me pidio la presente original
/home/rpalomares/TFM/TFM-Docs-01-40-ALTO/lines/IMG_5873_output_26.png,"do fueron testigos Dn. Josef Pelaez, Dn. Rafa"
/home/rpalomares/TFM/TFM-Docs-01-40-ALTO/lines/IMG_5884_output_04.png,Los Ssres. Lecuteun Despon
/home/rpalomares/TFM/TFM-Docs-01-40-ALTO/lines/IMG_5888_output_32.png,Granger Banfill= A los Señores Counant Bridel y Com-
/home/rpalomares/TFM/TFM-Docs-01-40-ALTO/lines/IMG_5878_output_29.png,"a Dn Antonio Josef de Cascallana: Thomas Moore Fos Ketl,"
/home/rpalomares/TFM/TFM-Docs-01-40-ALTO/lines/IMG_5878_output_01.png,Veinte maravedis.
/home/rpalomares/TFM/TFM-Docs-01-40-ALTO/lines/IMG_5900_output_28.png,Paguese a la orden de los Señors. dn. Diego Suton y Compa. al cam-
/home/rpalomares/TFM/TFM-Docs-01-40-ALTO/lines/IMG_5886_output_13.png,entos noventa y tres: ante mi el Ynfras-
/home/rpalomares/TFM/TFM-Docs-01-40-ALTO/lines/IMG_5889_output_11.png,to y protesto y que amienden el que enterado Dijo
/home/rpalomares/TFM/TFM-Docs-01-40-ALTO/lines/IMG_5886_output_42.png,ala orden delos Sres. Rousseau Baquenau y Compañia valor en cuenta or-
/home/rpalomares/TFM/TFM-Docs-01-40-ALTO/lines/IMG_5881_output_03.png,"MARAVEDIS, AÑO DE MIL"
/home/rpalomares/TFM/TFM-Docs-01-40-ALTO/lines/IMG_5863_output_34.png,Hijos de Dn. Lucar pagaderas en Aceptamos
/home/rpalomares/TFM/TFM-Docs-01-40-ALTO/lines/IMG_5891_output_12.png,total de la Cantidad dedha letra pr. estar entendido no cumplir
/home/rpalomares/TFM/TFM-Docs-01-40-ALTO/lines/IMG_5873_output_22.png,te laqual el requirente se afirmo en sus protes-
/home/rpalomares/TFM/TFM-Docs-01-40-ALTO/lines/IMG_5863_output_30.png,de a trescientos setenta y cinco mas pr. ducado. va-
/home/rpalomares/TFM/TFM-Docs-01-40-ALTO/lines/IMG_5894_output_34.png,Y asi copiada dha. Letra el referido Dn. Fran-
/home/rpalomares/TFM/TFM-Docs-01-40-ALTO/lines/IMG_5888_output_10.png,Bridel y Compa.
/home/rpalomares/TFM/TFM-Docs-01-40-ALTO/lines/IMG_5862_output_10.png,vista expuso no la pagara por las razones que manifesto en
/home/rpalomares/TFM/TFM-Docs-01-40-ALTO/lines/IMG_5874_output_09.png,dio por contento y entregado asu voluntad y
/home/rpalomares/TFM/TFM-Docs-01-40-ALTO/lines/IMG_5873_output_06.png,Paguese a la orden de Dn. Diego Duff valor
/home/rpalomares/TFM/TFM-Docs-01-40-ALTO/lines/IMG_5863_output_10.png,y Compañia
/home/rpalomares/TFM/TFM-Docs-01-40-ALTO/lines/IMG_5878_output_37.png,Prosigue
/home/rpalomares/TFM/TFM-Docs-01-40-ALTO/lines/IMG_5887_output_19.png,"lo doy delo que dho es en la forma que puedo, que no firmo por"
/home/rpalomares/TFM/TFM-Docs-01-40-ALTO/lines/IMG_5862_output_22.png,Josef Roguen
/home/rpalomares/TFM/TFM-Docs-01-40-ALTO/lines/IMG_5876_output_13.png,publico y mayor del cavildo y Ayuntami-
/home/rpalomares/TFM/TFM-Docs-01-40-ALTO/lines/IMG_5882_output_22.png,Negociante en Cadiz
/home/rpalomares/TFM/TFM-Docs-01-40-ALTO/lines/IMG_5867_output_31.png,del y Compañia
/home/rpalomares/TFM/TFM-Docs-01-40-ALTO/lines/IMG_5870_output_28.png,"de las referidas tres Letras, consistentes"
/home/rpalomares/TFM/TFM-Docs-01-40-ALTO/lines/IMG_5864_output_21.png,Heguiluz y comp. mediante la aceptacion
/home/rpalomares/TFM/TFM-Docs-01-40-ALTO/lines/IMG_5895_output_04.png,se afirmo en sus Protestos me lo pidio pr.
/home/rpalomares/TFM/TFM-Docs-01-40-ALTO/lines/IMG_5873_output_21.png,q. escribe al librador esto dio pr. su respuesta no obstan-
/home/rpalomares/TFM/TFM-Docs-01-40-ALTO/lines/IMG_5889_output_16.png,de la citada Letra hize igual requerimiento a Dn.
/home/rpalomares/TFM/TFM-Docs-01-40-ALTO/lines/IMG_5898_output_08.png,Contra
